chunk_id,source_doc,page,chunk_index,text
b3099d52-7c71-4922-a8f8-1596feb0fbdb,hackrx-2.pdf,2,0,"CHOLAMANDALAM MS GENERAL INSURANCE COMPANY LIMITED Registered Office: 2nd Floor, “DARE House”, 2, N.S.C. Bose Road, Chennai – 600 001. Toll free: 1800 208 9100, T: +91 (0) 44 4044 5400, F: +91 (0) 44 4044 5550 E: customercare@cholams.murugappa.com; website: www.cholainsurance.com IRDA Regn. No.123; PAN AABCC6633K CIN U66030TN2001PLC047977 GROUP DOMESTIC TRAVEL INSURANCE CHOTGDP23004V012223 Policy Wordings Page 2 of 101 We issue this Group insurance policy to the Proposer based on the information provided by the Proposer in the proposal form and premium paid by the Proposer. This insurance is subject to the following terms and conditions. The method of coverage and the Benefit Limits that has been opted is indicated in the Policy Schedule/Policy Certificate. The term You/Your/Insured/Insured Person in this document refers to the individual group members who will be treated as Insured beneficiary and the term Proposer/Policy Holder/Group Manager/Group Organizer in this document refers to Person/ Organisation who has signed the proposal form and in whose name the policy is issued. Also the term Insurer/Us/Our/Company in this document refers to Cholamandalam MS General Insurance Company Limited. Master policy will be issued in the name of Group Manager and individual certificate may be issued to the beneficiaries. 1. DEFINITIONS Any word or expression to which a specific meaning has been assigned in any part of this Policy or the Schedule/ Certificate shall bear the same meaning wherever it appears in the Policy, including any subsequent endorsements to this Policy and the Policy Schedule/Certificate. Where the context permits, references to the singular shall also include references to the plural, similarly references to the male gender shall also include references to the female gender, and vice versa in both cases. For purposes of this Policy, the terms specified below shall have the meaning set forth: A) STANDARD DEFINITONS Accident / Accidental mean a sudden, unforeseen and involuntary event caused by external, visible and violent means. Cashless facility means a facility extended by the Insurer to the insured where the payments, of the costs of treatment undergone by the insured in accordance with the policy terms and conditions, are directly made to the network provider by the Insurer to the extent pre-authorization is approved. Condition Precedent means a policy term or condition upon which the Insurer’s liability under the policy is conditional upon. Congenital Anomaly means a condition which is present since birth, which is abnormal with reference to form, structure or position. a. Internal Congenital Anomaly: Congenital anomaly which is not in the visible and accessible parts of the body. b. External Congenital Anomaly: Congenital anomaly which is in the visible and accessible parts of the body. Deductible means a cost-sharing requirement under this policy, that provides that the Insurer will not be liable for a specified amount or percentage of claim amount and/or number of days and/or number of hours as specified in the policy schedule/certificate of insurance which will apply before any benefits are payable by the Insurer. A deductible does not reduce the Sum Insured and is applicable"
41324371-88be-47b3-9a37-2818a14a0b2c,hackrx-2.pdf,2,1,"position. a. Internal Congenital Anomaly: Congenital anomaly which is not in the visible and accessible parts of the body. b. External Congenital Anomaly: Congenital anomaly which is in the visible and accessible parts of the body. Deductible means a cost-sharing requirement under this policy, that provides that the Insurer will not be liable for a specified amount or percentage of claim amount and/or number of days and/or number of hours as specified in the policy schedule/certificate of insurance which will apply before any benefits are payable by the Insurer. A deductible does not reduce the Sum Insured and is applicable per event up to the specified limits mentioned. Disclosure to information norm means the Policy shall be void and all premium paid hereon shall be forfeited to the Company, in the event of misrepresentation, mis-description or non-disclosure of any material fact. Hospital means any institution established for inpatient care and day care treatment of illness and/or injuries and which has been registered as a hospital with the local authorities under the Clinical Establishments (Registration and"
d6fa2c42-10e9-4845-a57f-2dabde8fdff0,hackrx-2.pdf,3,0,"CHOLAMANDALAM MS GENERAL INSURANCE COMPANY LIMITED Registered Office: 2nd Floor, “DARE House”, 2, N.S.C. Bose Road, Chennai – 600 001. Toll free: 1800 208 9100, T: +91 (0) 44 4044 5400, F: +91 (0) 44 4044 5550 E: customercare@cholams.murugappa.com; website: www.cholainsurance.com IRDA Regn. No.123; PAN AABCC6633K CIN U66030TN2001PLC047977 GROUP DOMESTIC TRAVEL INSURANCE CHOTGDP23004V012223 Policy Wordings Page 3 of 101 Regulation) Act 2010 or under the enactments specified under the Schedule of Section 56(1) of the said Act OR complies with all minimum criteria as under: - has qualified nursing staff under its employment round the clock; - has at least 10 in-patient beds in towns having a population of less than 10,00,000 and at least 15 in-patient beds in all other places; - has qualified medical practitioner(s) in charge round the clock; - has a fully equipped operation theatre of its own where surgical procedures are carried out; - maintains daily records of patients and makes these accessible to the insurance company’s authorized personnel Hospitalisation means admission in a Hospital for a minimum period of 24 consecutive ‘In-patient Care’ hours except for specified procedures/ treatments, where such admission could be for a period of less than 24consecutive hours. Illness means a sickness or a disease or pathological condition leading to the impairment of normal physiological function and requires medical treatment. a. Acute condition is a disease, illness or injury that is likely to respond quickly to treatment which aims to return the person to his or her state of health immediately before suffering the disease/illness/injury which leads to full recovery. b. Chronic condition is defined as a disease, illness, or injury that has one or more of the following characteristics:—it needs ongoing or long-term monitoring through consultations, examinations, check- ups, and / or tests—it needs ongoing or long-term control or relief of symptoms— it requires rehabilitation for the patient or for the patient to be specially trained to cope with it—it continues indefinitely—it recurs or is likely to recur. Injury means accidental physical bodily harm excluding illness or disease, solely and directly caused by external, violent and visible and evident means which is verified and certified by a Medical Practitioner. In Patient Care means treatment for which the insured person has to stay in a hospital for more than 24 hours for a covered event. Maternity Expenses means a. medical treatment expenses traceable to childbirth (including complicated deliveries and caesarean sections incurred during hospitalization) b. expenses towards lawful medical termination of pregnancy during the policy period Medical Advice means any consultation or advice from a Medical Practitioner including the issuance of any prescription or follow-up prescription Medical Expenses means those expenses that an Insured Person has necessarily and actually incurred for medical treatment on account of Illness or Accident on the advice of a Medical Practitioner, as long as these are no more than would have been payable if the Insured Person had not been insured and no more than other hospitals or doctors in the same locality would have"
510cb408-48c2-479a-9f9c-c3e9d979e0c7,hackrx-2.pdf,3,1,"sections incurred during hospitalization) b. expenses towards lawful medical termination of pregnancy during the policy period Medical Advice means any consultation or advice from a Medical Practitioner including the issuance of any prescription or follow-up prescription Medical Expenses means those expenses that an Insured Person has necessarily and actually incurred for medical treatment on account of Illness or Accident on the advice of a Medical Practitioner, as long as these are no more than would have been payable if the Insured Person had not been insured and no more than other hospitals or doctors in the same locality would have charged for the same medical treatment. Medical Practitioner means a person who holds a valid registration from the Medical Council or appropriate authority of the country where Insured Person is availing emergency treatment outside India/ Country of origin and is thereby entitled to practice medicine within its jurisdiction; and is acting within the scope and jurisdiction of license. The term Medical Practitioner includes any qualified physician, specialist, or surgeon, and should not be an Immediate Family Member of the Insured Person or related to the Insured Person by way of blood, marriage, adoption, employment, or any pre-existing business relationship. Medically Necessary Treatment means any treatment, tests, medication, stay in Hospital or part of a stay in Hospital in relation to the Insured Person which: i. is required for the medical management of the Illness or Injury suffered by the Insured Person;"
e283a44e-e5c2-430d-b7a7-2ee62dcedaf3,hackrx-2.pdf,4,0,"CHOLAMANDALAM MS GENERAL INSURANCE COMPANY LIMITED Registered Office: 2nd Floor, “DARE House”, 2, N.S.C. Bose Road, Chennai – 600 001. Toll free: 1800 208 9100, T: +91 (0) 44 4044 5400, F: +91 (0) 44 4044 5550 E: customercare@cholams.murugappa.com; website: www.cholainsurance.com IRDA Regn. No.123; PAN AABCC6633K CIN U66030TN2001PLC047977 GROUP DOMESTIC TRAVEL INSURANCE CHOTGDP23004V012223 Policy Wordings Page 4 of 101 ii. must not exceed the level of care necessary to provide safe, adequate and appropriate medical care in scope, duration, or intensity; iii. must have been prescribed by a Medical Practitioner; must conform to the professional standards widely accepted in international medical practice or by the medical community in India. Network Provider/ Hospital means Hospitals or health care providers enlisted by an insurer, TPA or jointly by an Insurer and TPA to provide medical services to an insured by a cashless facility. Non- Network means any hospital, day care centre or other provider that is not part of the network. Notification of claim means the process of intimating a claim to the insurer or TPA through any of the recognized modes of communication. OPD treatment means is the one in which the Insured visits a clinic / hospital or associated facility like consultation room for diagnosis and treatment based on the advice of a Medical Practitioner. The insured is not admitted as a day care or in- patient. OPD to include emergency root canal treatment Pre-existing Disease means any condition, ailment, injury or disease: a) That is/are diagnosed by a physician within 48 months prior to the effective date of the policy issued by the Insurer or its reinstatement or b) For which medical advice or treatment was recommended by, or received from, a physician within 48 months prior to the effective date of the policy issued by the insurer or its reinstatement. Qualiﬁed Nurse means a person who holds a valid registration from the Nursing Council of India or the Nursing Council of any state in India. Reasonable and Customary Charges means the charges for services or supplies, which are the standard charges for the speciﬁc provider and consistent with the prevailing charges in the geographical area for identical or similar services, taking into account the nature of the illness / injury involved. Renewal means the terms on which the contract of insurance can be renewed on mutual consent with a provision of grace period for treating the renewal continuous for the purpose gaining credit for pre-existing diseases, time- bound exclusions and for of all waiting periods. Subrogation means the right of the insurer to assume the rights of the insured person to recover expenses paid out under the policy that may be recovered from any other source. Unproven/ Experimental treatment means the treatment including drug experimental therapy which is not based on established medical practice in India, is treatment experimental or unproven. B) SPECIFIC DEFINITIONS Air Travel means travel by an airline/aircraft for the purpose of flying therein as a Fare paying passenger. Alternative Treatments means forms of treatments"
e03c1797-03a3-4bec-843f-a912cbae615d,hackrx-2.pdf,4,1,"for the purpose gaining credit for pre-existing diseases, time- bound exclusions and for of all waiting periods. Subrogation means the right of the insurer to assume the rights of the insured person to recover expenses paid out under the policy that may be recovered from any other source. Unproven/ Experimental treatment means the treatment including drug experimental therapy which is not based on established medical practice in India, is treatment experimental or unproven. B) SPECIFIC DEFINITIONS Air Travel means travel by an airline/aircraft for the purpose of flying therein as a Fare paying passenger. Alternative Treatments means forms of treatments other than treatment ""Allopathy"" or ""modern medicine"" and includes Ayurveda, Unani, Siddha and Homeopathy in the Indian context. Appliances shall mean and include electrical, mechanical and electronic appliances used for household including whilst in travel use Adventure Sports means and includes skydiving/parachuting, parasailing, hang gliding, paragliding, ballooning bungee jumping, scuba diving, mountaineering or rock climbing (where ropes or guides are customarily used), Speed contest or racing of any kind, caving or pot-holing, abseiling, hunting or equestrian activities, deep sea diving, skin diving or other underwater activity, polo, snow and ice sports, rafting or canoeing involving white water rapids, yachting or boating, , Base Jumping, Ski Jumping, Trekking, Adventure racing on land and water, Snorkeling, Kayaking, Surﬁng, marathon running as a non-professional, biking, races as a non-professional, any bodily contact sport or any other hazardous or potentially dangerous sport."
d5fc97da-87fa-4844-a0c0-21495f4db10b,hackrx-2.pdf,5,0,"CHOLAMANDALAM MS GENERAL INSURANCE COMPANY LIMITED Registered Office: 2nd Floor, “DARE House”, 2, N.S.C. Bose Road, Chennai – 600 001. Toll free: 1800 208 9100, T: +91 (0) 44 4044 5400, F: +91 (0) 44 4044 5550 E: customercare@cholams.murugappa.com; website: www.cholainsurance.com IRDA Regn. No.123; PAN AABCC6633K CIN U66030TN2001PLC047977 GROUP DOMESTIC TRAVEL INSURANCE CHOTGDP23004V012223 Policy Wordings Page 5 of 101 Assistance Service Provider means Third Party administrator or any organization or institution appointed by the Company, for providing services to the Insured Person for an Insured Event covered. Baggage shall mean articles and / or personal eﬀects of the Insured (other than property of the Business) in packing or in containers suitable and standard to the mode of Travel that is accompanied by the Insured or whilst such Baggage is lodged either in a locked private room of a hotel or guest house or any other accommodation occupied by the Insured during the Insured's stay at that location or in a public locker facility availed by the Insured during the course of or at any intermediate stage of the Travel. Base Sum Insured means the Sum Insured as specified in the Policy Schedule/Certificate against the respective base covers. Burglary means theft involving entry into or exit from the Insured Person’s home in India by forcible and violent means or following assault or violence or threat thereof, to the Insured Person or to any Immediate Family Member or any person residing lawfully in the Insured Person’s residence, with intent to commit a felony therein and includes housebreaking. Checked-in Baggage means each suitcase or baggage handed over by the Insured Person and accepted by a Common Carrier for transportation in the same Common Carrier in which the Insured Person is or would be travelling, and for which the Common Carrier has issued a baggage receipt to the Insured Person. Checked-in Baggage excludes all items that are carried/ transported under any contract of affreightment. Common Carrier means any transport means by civilian land, rail, water or Scheduled Airline in each case operated under a valid license for the transportation of passengers for hire. Contents mean and include electrical and electronic equipment, household appliances, furniture, ﬁxture, ﬁttings, linen, clothing, interior decorations, kitchen items, cutlery /crockery contained in the Insured's home belonging to the Insured or his/her family members permanently residing with the Insured including items for which the Insured is responsible, and used for domestic use. However, this does not include deeds, bonds, bills of exchange, promissory notes, cheques, traveller's cheques, and securities for money, documents of any kind, cash, and currency notes. Corporate means any organization, firm, society or body corporate on whose name the policy is issued. Dependent Child refers to a child (natural or legally adopted), below the age of 23 years, who is ﬁnancially dependent on the primary insured or proposer and does not have his / her independent sources of income. Disease means an alteration in the state of the body or of some of its organs interrupting or disrupting"
241383c3-da8d-4ea1-bb19-a1b837445987,hackrx-2.pdf,5,1,"use. However, this does not include deeds, bonds, bills of exchange, promissory notes, cheques, traveller's cheques, and securities for money, documents of any kind, cash, and currency notes. Corporate means any organization, firm, society or body corporate on whose name the policy is issued. Dependent Child refers to a child (natural or legally adopted), below the age of 23 years, who is ﬁnancially dependent on the primary insured or proposer and does not have his / her independent sources of income. Disease means an alteration in the state of the body or of some of its organs interrupting or disrupting the performance of the functions, and causing or threatening pain and weakness or physical or mental disorder and certiﬁed by a Medical Practitioner. Family means the Insured, his/her lawful spouse and maximum of any two dependent children up to the age of 25 years, parents, parents-in laws, siblings, children’s in laws, partner Felonious Assault means an act of violence against the Insured Person or a Travelling Companion requiring medical treatment. Financial Emergency means a situation where in the Insured Person loses all or a substantial amount of his/her travel funds due to theft, robbery, mugging or dacoity, which has detrimental effects on his/her travel plans. Group A group should consist of persons who assemble together with a commonality of purpose or engaging in a common economic activity like employees of a company. It includes non-employer–employee groups like employee welfare associations, co-operative society’s, Group policies being taken by Government bodies for certain identifiable groups, credit/debit card/kisan credit card holders insured through the card issuance company, customers of a particular business, professional associations, borrowers/depositors of a bank, customers of a bank or aggregators, or members of any similar group being administered by a group administration wherein Insurance is being provided as an add-on benefit. Hazardous Occupation means persons whilst working in underground mines, explosives, magazines, workers whilst involved in electrical installation with high tension supply, jockeys, circus personnel, Aircraft pilots and crew, armed"
22c95e53-39b1-4ef8-a805-e4428010a49f,hackrx-2.pdf,6,0,"CHOLAMANDALAM MS GENERAL INSURANCE COMPANY LIMITED Registered Office: 2nd Floor, “DARE House”, 2, N.S.C. Bose Road, Chennai – 600 001. Toll free: 1800 208 9100, T: +91 (0) 44 4044 5400, F: +91 (0) 44 4044 5550 E: customercare@cholams.murugappa.com; website: www.cholainsurance.com IRDA Regn. No.123; PAN AABCC6633K CIN U66030TN2001PLC047977 GROUP DOMESTIC TRAVEL INSURANCE CHOTGDP23004V012223 Policy Wordings Page 6 of 101 forces personnel, artistes engaged in hazardous performances, aerial crop sprayer, Demolition contractor, explosives users, Fisherman (Seagoing, Jockey, Marine Salvager, Miner and other occupations underground, nuclear installations, Off-shore oil or gas rig worker, professional sports person, roofing contractors and all construction, maintenance and repair workers at heights in excess of 50ft/15m, saw miller, scaffolder, ship crew, steeplejack, stevedore, structural steelworker, tower crane operator, tree feller. Hijack means any unlawful seizure or exercise of control, by force or violence or threat of force or violence and with wrongful intent, of the Common Carrier in which the Insured Person is travelling. Housebreaking means an act involving physical break-in and unauthorized and forcible entry into Insured Person's home in India, or any threat, with intent to commit crime. Immediate family member shall mean any member of the Insured Person's immediate family i.e the Insured Person's spouse, children, parents, parents in law, Children in law, sibling, partner or travelling companion. Inclement Weather means any severe catastrophic weather conditions which delay the scheduled arrival or departure of a Common Carrier but not including normal, seasonal/climatic weather changes. Insured/Insured Person means the person named in the Policy Schedule, who has a permanent place of residence in India and for whom the insurance is proposed and appropriate premium paid. It includes foreign travelers having traveler visa. Insured Event means an event, loss or damage specifically described as covered and for which the Insured Person is entitled to benefit/s under this Policy. Land/Sea Arrangements means pre-paid travel arrangements for a scheduled tour, trip or cruise included within the description of covered Trips on the Proposal/Enrollment and Declaration Form and arranged by a tour operator, travel agent, or other organization. Life threatening condition / situation” refers to a medical condition suﬀered by the Insured which has the following characteristics: i. Markedly unstable vital parameters (blood pressure, pulse, temperature and respiratory rate). ii. Acute impairment of one or more vital organ systems (involving brain, heart, lungs, Liver, Kidneys and pancreas). iii. Critical care being provided, which involves high complexity decision making to assess, manipulate and support vital system function(s) to treat single or multiple vital organ failure(s) and requires interpretation of multiple physiological parameters and application of advanced technology. iv. Critical care being provided in critical care area such as coronary care unit, intensive care unit, respiratory care unit, or the emergency department. Loss means loss or damage. Man days is a 24 hours’ period starting from midnight for an individual whilst travelling within the territorial boundaries of India. Master Policy Schedule/Policy Schedule means schedule attached to and forming part of this Policy, mentioning the details of the Proposer / Group Manager,"
e08d4184-f18a-491b-b15a-fda982c0e140,hackrx-2.pdf,6,1,"assess, manipulate and support vital system function(s) to treat single or multiple vital organ failure(s) and requires interpretation of multiple physiological parameters and application of advanced technology. iv. Critical care being provided in critical care area such as coronary care unit, intensive care unit, respiratory care unit, or the emergency department. Loss means loss or damage. Man days is a 24 hours’ period starting from midnight for an individual whilst travelling within the territorial boundaries of India. Master Policy Schedule/Policy Schedule means schedule attached to and forming part of this Policy, mentioning the details of the Proposer / Group Manager, the Sum Insured, Period and limits to which benefits under the policy would be payable. Multi trip means two or more trips to destinations of Republic of India during the Policy period. Natural Teeth means natural teeth that is unaltered or is fully restored to their normal function and is Disease-free, have no decay and are not more susceptible to Injury than unaltered natural teeth. Period of Insurance in respect of Single Trip Policy means the period from the commencement date of the insurance cover to the Risk end Date as speciﬁed in the Policy Schedule/certificate or on the date when the insured returns to his/her usual town of residence or the date of cancellation of the insurance, whichever is earlier Period of Insurance in respect of the Multi Trip/ Annual policy shall mean the period from Commencement of Insurance cover to the end of the insurance cover or full utilization of the maximum number of travel days per trip as mentioned in Policy Schedule/Certificate, or expiry of the Policy or cancellation of the insurance, whichever is earlier."
